{
  "schema_version": 1,
  "model_id": "funasr:paraformer-zh",
  "provider": "funasr",
  "display_name": "FunASR Paraformer Chinese",
  "version": "speech_paraformer-large-asr-nat-zh-cn-16k-common-vocab8404",
  "license": "UNRESOLVED-MODEL-LICENSE",
  "source_url": "https://www.modelscope.cn/models/iic/speech_paraformer-large_asr_nat-zh-cn-16k-common-vocab8404-pytorch",
  "sends_data_off_device": false,
  "estimated_size_bytes": 500000000,
  "install_mode": "user_provided",
  "requires_explicit_install": true,
  "approved_for_local_use": false,
  "approved_for_distribution": false
}
